Море (Острова);20;"Пхи-Пхи ""5 Пляжей"" (ХИТ)";ХИТ;#нельзя_беременным #дети_от_1_года #классика #бюджетно #снорклинг #майя_бей #обезьяны #хит;https://goldenkeytours.com/excursions/sea-excursions/phi-phi-5-islandss;50%;2000;1800;Визитная карточка Пхукета! Та самая бухта Майя Бэй из фильма «Пляж», изумрудная лагуна Пиле и пляж с обезьянами.;Самый популярный тур, и не зря. Виды здесь — просто космос (скалы растут прямо из воды), но будьте готовы: туристов будет много. Must see для новичков.;Трансфер включен (возможна доплата в зависимости от района). Беременным запрещено. Детям до 1 года запрещено. Классическая программа.;пхи пхи, пи пи, 5 островов, майя бэй, беременным нельзя, нельзя детям до 1 года, спидбот, speed boat, тряска, хит, популярное, лучшее, топ.;Ежедневно;Русский;Обед на острове;Коралловые тапочки, Пляжные вещи, Крем SPF 50+
Море (Острова);21;Пхи-Пхи + Бамбу (Спидбот, рыбалка);ХИТ;#нельзя_беременным #дети_от_1_года #бюджетно #бамбу #классика #снорклинг #майя_бэй;https://goldenkeytours.com/excursions/sea-excursions/phi-phi-and-fishing;50%;2400;2100;Базовая программа по отличной цене. Все главные локации Пхи-Пхи и релакс на острове Бамбу.;"Отличный выбор, если не хотите переплачивать за ""плюшки"". Море везде одинаковое, виды те же. Просто лодка попроще и людей чуть больше.";Трансфер включен (возможна доплата в зависимости от района). Беременным запрещено. Детям до 1 года запрещено. Обед на Пхи-Пхи Дон.;пхи пхи, пи пи, бамбу, bamboo, стандарт, беременным нельзя, нельзя детям до 1 года, дешево;Вт, Чт, Сб;Русский;Обед, Сашими;Таблетки от укачивания, Пляжные вещи
Море (Острова);22;Пхи-Пхи + Бамбу + Ранг Яй (Комфорт+, Рыбалка) (ХИТ);ХИТ;#нельзя_беременным #дети_от_1_года #рыбалка #мужская_компания #свежая_рыба #снорклинг #активно #хит;https://goldenkeytours.com/excursions/sea-excursions/phi-phi-and-fishing;50%;2700;2400;Супер-комбо: 3 острова и рыбалка в одной поездке с повышенным комфортом.;Очень насыщенная программа, которая заканчивается релаксом на жемчужном острове Ранг Яй.;Комфортная посадка, индивидуальные места. Королевский пирс Royal Phuket Marina. Маленькие группы до 24-36 человек. Бесплатные одноразовые загубники. Полноценный завтрак на пирсе. Бесплатный Wi-Fi на лодке. Бесплатные полотенца. Трансфер включен. Беременным запрещено. Детям до 1 года запрещено.;пхи пхи, пи пи, рыбалка, троллинг, сашими, беременным нельзя, нельзя детям до 1 года, лодка, море, волны, хит, популярное, лучшее, топ.;Вт, Чт, Сб;Русский;Обед, Сашими;Таблетки от укачивания, Пляжные вещи
Море (Острова);23;Пхи-Пхи на Катамаране (Стандарт);;#нельзя_беременным #дети_от_1_года #комфорт #спокойно #семейный #нет_качки #безопасно;https://goldenkeytours.com/excursions/sea-excursions/phi-phi-catamaran;50%;2800;2600;Спокойный семейный круиз к легендарным скалам. Без спешки и тряски.;Идет медленнее спидбота, но намного мягче. Идеально для пожилых людей и детей, которых обычно укачивает.;Трансфер включен (возможна доплата в зависимости от района). Беременным запрещено. Детям до 1 года запрещено. Стабильная лодка.;пхи пхи, катамаран, беременным нельзя, нельзя детям до 1 года, открытое море, укачивание;Ежедневно;Русский, по запросу;Обед, фрукты, напитки;Пляжные вещи
Море (Острова);24;Пхи-Пхи на Катамаране (Премиум);ХИТ;#нельзя_беременным #дети_от_1_года #vip #премиум #яхта #сервис #комфорт #лакшери #катамаран;https://goldenkeytours.com/excursions/sea-excursions/phi-phi-premium;50%;3000;2800;VIP-круиз для тех, кто ценит сервис. Роскошная лодка, вкусный обед и атмосфера праздника.;Это не просто трансфер к островам, а полноценный отдых на борту. Шикарные фото в соцсети обеспечены.;Комфортная посадка в катамаране, индивидуальные места. Люксовый порт. Бесплатный трансфер из Као Лака (Вторник/Среда/Четверг/Суббота). Беременным запрещено. Детям до 1 года запрещено. Высокий сервис.;пхи пхи, премиум, яхта, беременным нельзя, нельзя детям до 1 года, открытое море, волны, безопасность, катамаран;Ежедневно;Русский, Ср, Чт, Сб, Вс;Обед, фрукты, напитки;Красивая одежда, Камера, Пляжные вещи
Море (Острова);25;"Пхи-Пхи + Кхай ""Поздний выезд"" (Закат)";;#нельзя_беременным #дети_от_1_года #можно_поспать #закат #романтика #вечер #без_спешки;https://goldenkeytours.com/excursions/sea-excursions/phi-phi-late-departure;50%;2200;1900;Экскурсия для сов! Выспитесь, позавтракайте и отправляйтесь к островам без спешки, чтобы проводить закат в море.;Главный плюс — комфортное время старта. А закат в открытом море с лихвой перекрывает дневную жару.;Трансфер включен (возможна доплата в зависимости от района). Беременным запрещено. Детям до 1 года запрещено. Отправление с пирса в 10-11 утра.;поздний выезд, пхи пхи, закат, беременным нельзя, нельзя детям до 1 года, море, возвращение в темноте;Ежедневно;Нет;Обед, Ужин;Пляжные вещи
Море (Острова);26;"Пхи-Пхи + Кхай/Бамбу ""Закат"" (Катамаран)";;#нельзя_беременным #дети_от_1_года #можно_поспать #закат #романтика #вечер #без_спешки;https://goldenkeytours.com/excursions/sea-excursions/phi-phi-late-departure;50%;2800;2600;Романтика на закате с комфортом катамарана. Плавное скольжение по волнам и вечерние краски неба.;Выезд без спешки (можно выспаться), плавный ход и невероятно красивый вечер на воде.;Трансфер включен. Беременным запрещено. Детям до 1 года запрещено. Выезд в 10-11 утра.;поздний выезд, пхи пхи, закат, беременным нельзя, нельзя детям до 1 года, море, возвращение в темноте;Пн, пт;Русский;Обед, фрукты, напитки;Пляжные вещи
Море (Острова);27;Пхи-Пхи + Бамбу, 2 дня (Стандарт);;#нельзя_беременным #дети_от_1_года #комфорт #баунти #белый_песок #релакс #семейный #нет_качки;https://goldenkeytours.com/excursions/sea-excursions/phi-phi-and-bamboo;50%;4500;4200;Полное погружение в жизнь острова! Днем — пляжи, ночью — огненное шоу и танцы на песке.;Одного дня на Пхи-Пхи мало. Ночевка дает вам шанс увидеть остров вечером (когда он оживает) и рано утром (пока он спит и нет толп).;Трансфер включен (возможна доплата в зависимости от района). Беременным запрещено. Детям до 1 года запрещено. Остров Бамбу включен.;пхи пхи, бамбу, катамаран, bamboo, беременным нельзя, нельзя детям до 1 года, море;Вт, Чт, Сб;Русский;Обед, фрукты, напитки;Пляжные вещи
Море (Острова);28;Пхи-Пхи + Бамбу, 2 дня (Комфорт+, спидбот);;#нельзя_беременным #дети_от_1_года #комфорт #баунти #белый_песок #релакс #семейный #нет_качки;https://goldenkeytours.com/excursions/sea-excursions/phi-phi-and-bamboo;50%;5000;4700;Релакс-тур на 2 дня. Сочетание бурной ночной жизни и комфортной дороги на катамаране.;Вы не устанете в пути благодаря катамарану, а улучшенный отель позволит хорошо выспаться после вечеринки.;Королевский пирс Royal Phuket Marina. Маленькие группы до 36 человек. Бесплатные одноразовые загубники. Полноценный завтрак на пирсе. Улучшенная категория номера в отеле. Бесплатный Wi-Fi на лодке. Бесплатные полотенца. Трансфер включен. Беременным запрещено. Детям до 1 года запрещено. Остров Бамбу включен.;пхи пхи, бамбу, катамаран, bamboo, беременным нельзя, нельзя детям до 1 года, море;Вт, Чт, Сб;Русский;Обед, фрукты, напитки;Пляжные вещи
Море (Острова);29;Пхи-Пхи + Краби + Джеймс Бонд, 2 дня (комфорт+);;#нельзя_беременным #дети_от_1_года #насыщенно #все_сразу #активно #инстаграм #весь_день #устанем_но_довольны #вечеринки_на_пляже #2_дня;https://goldenkeytours.com/excursions/sea-excursions/phiphijamesbondkrabi#!/tab/767808483-2;50%;6100;5800;Грандиозный марафон! Три провинции и все топовые острова за одну поездку.;Идеально, если у вас мало времени, а хочется увидеть ВСЁ. Очень насыщенно, много переездов и впечатлений, но готовьтесь устать (приятно устать!).;Королевский пирс Royal Phuket Marina. Маленькие группы до 25-36 человек. Бесплатные одноразовые загубники. Полноценный завтрак на пирсе. Улучшенная категория номера в отеле. Бесплатный Wi-Fi на лодке. Бесплатные полотенца. Трансфер включен. Беременным запрещено. Детям до 1 года запрещено. Насыщенная программа.;пхи пхи, пи пи, краби, бонд, катамаран, беременным нельзя, нельзя детям до 1 года, тяжелая экскурсия, много переездов, Вечеринки на пляже, 2 дня.;Сб;Русский;Завтрак, обед, ужин;Коралловые тапочки, Пляжные вещи, удобная обувь
Море (Острова);30;Пхи-Пхи + Краби + Джеймс Бонд, 2 дня (премиум);;#нельзя_беременным #дети_от_1_года #насыщенно #все_сразу #активно #инстаграм #весь_день #устанем_но_довольны #вечеринки_на_пляже #2_дня;https://goldenkeytours.com/excursions/sea-excursions/phiphijamesbondkrabi#!/tab/767808483-3;50%;6900;6600;Грандиозный марафон в формате VIP! Три провинции и все топовые острова за одну поездку. Лучшие катера, улучшенный отель 4*.;Вы увидите всё самое главное: Бонда, Майя Бэй, Краби, но при этом путешествие будет по-настоящему премиальное.;Королевский пирс Royal Phuket Marina. Маленькие группы до 25-36 человек. Бесплатные одноразовые загубники. Полноценный завтрак на пирсе. Улучшенная категория отеля! Бесплатный Wi-Fi на лодке. Бесплатные полотенца. Трансфер включен. Беременным запрещено. Детям до 1 года запрещено. Насыщенная программа.;пхи пхи, пи пи, краби, бонд, катамаран, беременным нельзя, нельзя детям до 1 года, тяжелая экскурсия, много переездов, Вечеринки на пляже, 2 дня.;Ср, Пт;Русский;Завтрак, обед, ужин;Коралловые тапочки, Пляжные вещи, удобная обувь
Море (Острова);31;Пхи-Пхи + Краби + Джеймс Бонд, 2 дня (Стандарт) (ХИТ);ХИТ;#нельзя_беременным #дети_от_1_года #насыщенно #все_сразу #активно #инстаграм #весь_день #устанем_но_довольны #вечеринки_на_пляже #2_дня #хит;https://goldenkeytours.com/excursions/sea-excursions/phiphijamesbondkrabi;50%;5500;5200;"Бюджетная версия ""Главного марафона"". Те же легендарные локации по более доступной цене.";Вы увидите всё самое главное: Бонда, Майя Бэй, Краби. Чуть проще отель и лодка, но эмоций столько же.;Трансфер включен (возможна доплата в зависимости от района). Беременным запрещено. Детям до 1 года запрещено. Насыщенная программа.;пхи пхи, пи пи, краби, бонд, спидбот, беременным нельзя, нельзя детям до 1 года, тяжелая экскурсия, много переездов, Вечеринки на пляже, 2 дня, хит, популярное, лучшее, топ.;Ежедневно;Русский;Завтрак, обед, ужин;Коралловые тапочки, Пляжные вещи, удобная обувь
Море (Острова);32;11 Островов, Стандарт;;#нельзя_беременным #дети_от_1_года #ночевка #тусовка #активно #молодежь #огненное_шоу #бар;https://goldenkeytours.com/excursions/sea-excursions/11-islands;50%;4500;4100;Максимальный охват! Большое морское путешествие по 11 островам по доступной цене.;"Для тех, кто хочет поставить галочку ""Я видел всё"". Активно, много движения, ночевка на тусовочном Пхи-Пхи.";Трансфер включен (возможна доплата в зависимости от района). Беременным запрещено. Детям до 1 года запрещено. Ночевка на Пхи-Пхи.;11 островов, два дня, тусовка, пхи пхи, беременным нельзя, нельзя детям до 1 года, спидбот, нагрузка;Пн, Пт;Русский;Обед, фрукты, напитки;Деньги на бар, сменная одежда, коралловые тапочки
Море (Острова);33;11 Островов, Комфорт+;;#нельзя_беременным #дети_от_1_года #ночевка #тусовка #активно #молодежь #огненное_шоу #бар;https://goldenkeytours.com/excursions/sea-excursions/11-islands;50%;4900;4500;Максимальный драйв с комфортом! То же большое путешествие, но в малой группе и с лучшим сервисом.;Меньше людей в лодке — больше кислорода и внимания гида. Оптимальный выбор для насыщенного тура.;Королевский пирс Royal Phuket Marina. Маленькие группы до 32 человек. Бесплатные одноразовые загубники. Мороженое и вино по возвращению на пирс. Бесплатный Wi-Fi на лодке. Бесплатные полотенца. Трансфер включен. Беременным запрещено. Детям до 1 года запрещено. Ночевка на Пхи-Пхи.;11 островов, два дня, тусовка, пхи пхи, беременным нельзя, нельзя детям до 1 года, спидбот, нагрузка;Пн, Пт;Русский;Обед, фрукты, напитки;Деньги на бар, сменная одежда, коралловые тапочки
Море (Острова);34;5 Жемчужин Андамана, 2 дня (Комфорт+);;#нельзя_беременным #дети_от_1_года #ночевка #романтика #полное_погружение #вечеринка #огненное_шоу;https://goldenkeytours.com/excursions/sea-excursions/5-pearls-of-andaman;50%;6500;6200;"Самый красивый и романтичный двухдневный тур. Меньше ""гонки"", больше красоты и релакса.";Это тур про эстетику и удовольствие. Огненное шоу вечером и качественный отель сделают поездку незабываемой.;Королевский пирс Royal Phuket Marina. Маленькие группы до 36 человек. Бесплатные одноразовые загубники. Полноценный завтрак на пирсе. Улучшенная категория номера в отеле. Бесплатный Wi-Fi на лодке. Бесплатные полотенца. Трансфер включен. Беременным запрещено. Детям до 1 года запрещено. Ночевка в отеле.;вечеринка на пляже, 5 жемчужин, два дня, с ночевкой, пхи пхи, беременным нельзя, нельзя детям до 1 года, долгая дорога, море;Пн, Ср, Пт;Русский;Все включено;Паспорт (копия), Сменная одежда, Пляжные вещи
Море (Острова);35;5 Жемчужин Андамана, Стандарт, 2 дня;ХИТ;#нельзя_беременным #дети_от_1_года #ночевка #романтика #полное_погружение #вечеринка #огненное_шоу;https://goldenkeytours.com/excursions/sea-excursions/5-pearls-of-andaman;50%;6000;5700;Доступная романтика. Тот же великолепный маршрут по жемчужным островам.;Стандартный отель и лодка, но красота закатов и пляжей от этого не меняется. Отличный выбор по соотношению цена/качество.;Трансфер включен (возможна доплата в зависимости от района). Беременным запрещено. Детям до 1 года запрещено. Ночевка в отеле.;5 жемчужин, два дня, с ночевкой, пхи пхи, беременным нельзя, нельзя детям до 1 года, долгая дорога, море;Пн, Ср, Пт, Вс;Русский;Завтрак, Обед, Ужин;Паспорт (копия), Сменная одежда, Пляжные вещи
Море (Острова);36;Затерянный Мир (Lost World);;#нельзя_беременным #дети_от_1_года #эксклюзив #пещеры #нет_людей #природа #каяки;https://goldenkeytours.com/excursions/sea-excursions/lost-world;50%;3000;2500;Эксклюзив! Тайные лагуны и пещеры, куда мы заходим с фонариками.;Тур для тех, кто не любит толпы. Мы заходим в узкие проходы, куда не могут попасть большие корабли туристов. Чувствуешь себя первооткрывателем.;Скрытые лагуны Пханг Нга. Трансфер включен (возможна доплата в зависимости от района). Беременным запрещено. Детям до 1 года запрещено.;затерянный мир, пханг нга, спидбот, беременным нельзя, нельзя детям до 1 года;Ср, Сб;Русский;Легкий завтрак, Обед, напитки;Пляжные вещи
Море (Острова);37;Пхи-Пхи + Бамбу (Рассвет/Спидбот, 2 дня);;#нельзя_беременным #дети_от_1_года #ранний_выезд #бамбу #без_толп #снорклинг #бирюзовая_вода;https://goldenkeytours.com/phi-phi-and-bamboo-sunrise;50%;4500;4200;Рассветная программа на 2 дня! Ранний выезд — залог пустых пляжей и лучших фото.;Максимум моря и солнца. Вы увидите острова и в утренней тишине, и в лучах заката.;Трансфер включен (возможна доплата в зависимости от района). Беременным запрещено. Детям до 1 года запрещено. Ранний выезд.;пхи пхи, бамбу, рассвет, спидбот, беременным нельзя, нельзя детям до 1 года, скорость, волны;Ежедневно;Русский;Завтрак, Обед;Пляжные вещи
Море (Острова);38;Трансфер на Пхи-Пхи;;#нельзя_беременным #дети_от_1_года #трансфер #билет #спидбот #быстро;https://goldenkeytours.com/excursions/phi-phi-transfer;100%;1600;1600;Просто билет на спидбот в одну сторону. Быстро и с ветерком.;(Нет обзора);Трансфер с пляжей Ката, Карон и Патонг включен, с остальных пляжей по запросу. Беременным запрещено. Детям до 1 года запрещено. Требуется 100% предоплата.;трансфер, спидбот, speed boat, беременным нельзя, нельзя детям до 1 года;Ежедневно;Нет;Нет;Личные вещи
